{
  "id": "stemi-001",
  "title": "Acute Coronary Syndrome - STEMI",
  "description": "58-year-old male with acute chest pain",
  "chiefComplaint": "Severe chest pain for 2 hours",
  "patientInfo": {
    "age": 58,
    "gender": "male",
    "name": "John Smith",
    "occupation": "Construction worker"
  },
  "presentingSymptoms": {
    "primary": "Severe crushing chest pain",
    "associated": ["Shortness of breath", "Nausea", "Sweating"],
    "onset": "2 hours ago, sudden onset",
    "character": "Crushing, pressure-like",
    "radiation": "Left arm and jaw",
    "severity": "9/10"
  },
  "medicalHistory": {
    "pastMedical": ["Hypertension", "Diabetes mellitus type 2"],
    "medications": ["Metformin", "Lisinopril"],
    "allergies": ["NKDA"],
    "socialHistory": {
      "smoking": "20 pack-years, quit 5 years ago",
      "alcohol": "Occasional",
      "familyHistory": "Father died of MI at age 62"
    }
  },
  "physicalExamination": {
    "vitalSigns": {
      "bp": "160/95",
      "hr": "110",
      "rr": "22",
      "temp": "37.1",
      "o2sat": "94% on room air"
    },
    "general": "Diaphoretic, anxious, in moderate distress",
    "cardiovascular": "Tachycardic, regular rhythm, no murmurs",
    "respiratory": "Mild bibasilar crackles",
    "other": "Unremarkable"
  },
  "investigations": {
    "ecg": {
      "findings": "ST elevation in leads II, III, aVF; reciprocal changes in I, aVL",
      "interpretation": "Inferior STEMI"
    },
    "labs": {
      "troponin": "15.2 ng/mL (elevated)",
      "ck": "450 U/L (elevated)",
      "ckmb": "45 ng/mL (elevated)",
      "cbc": "WBC 12.5, Hgb 14.2, Plt 350",
      "bmp": "Na 140, K 4.2, Cl 102, CO2 24, BUN 18, Cr 1.1, Glucose 180"
    },
    "imaging": {
      "chestXray": "Mild pulmonary edema, normal heart size"
    }
  },
  "checklist": {
    "historyTaking": {
      "weight": 30,
      "items": [
        {
          "id": "onset_timing",
          "description": "Asked about onset and timing of chest pain",
          "critical": true,
          "points": 5
        },
        {
          "id": "pain_character",
          "description": "Characterized the chest pain (quality, severity, radiation)",
          "critical": true,
          "points": 5
        },
        {
          "id": "associated_symptoms",
          "description": "Asked about associated symptoms",
          "critical": false,
          "points": 3
        },
        {
          "id": "past_medical_history",
          "description": "Obtained relevant past medical history",
          "critical": false,
          "points": 3
        },
        {
          "id": "medications",
          "description": "Asked about current medications",
          "critical": false,
          "points": 2
        },
        {
          "id": "risk_factors",
          "description": "Assessed cardiovascular risk factors",
          "critical": true,
          "points": 4
        }
      ]
    },
    "physicalExamination": {
      "weight": 20,
      "items": [
        {
          "id": "vital_signs",
          "description": "Checked vital signs",
          "critical": true,
          "points": 5
        },
        {
          "id": "cardiovascular_exam",
          "description": "Performed cardiovascular examination",
          "critical": true,
          "points": 5
        },
        {
          "id": "respiratory_exam",
          "description": "Performed respiratory examination",
          "critical": false,
          "points": 3
        }
      ]
    },
    "investigations": {
      "weight": 25,
      "items": [
        {
          "id": "ecg",
          "description": "Ordered ECG",
          "critical": true,
          "points": 8
        },
        {
          "id": "cardiac_enzymes",
          "description": "Ordered cardiac enzymes/troponin",
          "critical": true,
          "points": 6
        },
        {
          "id": "basic_labs",
          "description": "Ordered basic metabolic panel and CBC",
          "critical": false,
          "points": 3
        },
        {
          "id": "chest_xray",
          "description": "Ordered chest X-ray",
          "critical": false,
          "points": 2
        }
      ]
    },
    "diagnosis": {
      "weight": 15,
      "items": [
        {
          "id": "primary_diagnosis",
          "description": "Correctly identified STEMI",
          "critical": true,
          "points": 10
        },
        {
          "id": "differential",
          "description": "Considered appropriate differential diagnoses",
          "critical": false,
          "points": 5
        }
      ]
    },
    "management": {
      "weight": 10,
      "items": [
        {
          "id": "emergency_treatment",
          "description": "Initiated appropriate emergency treatment",
          "critical": true,
          "points": 8
        },
        {
          "id": "cardiology_consult",
          "description": "Arranged urgent cardiology consultation",
          "critical": true,
          "points": 2
        }
      ]
    }
  },
  "expectedDiagnosis": "ST-elevation myocardial infarction (STEMI) - inferior wall",
  "learningObjectives": [
    "Recognize classic presentation of STEMI",
    "Perform systematic cardiovascular assessment",
    "Order appropriate diagnostic tests",
    "Initiate time-sensitive emergency treatment"
  ]
}